[
  {
    "honor_id": "HON_LIFETIME_001",
    "ceremony_id": "CEREMONY_003",
    "recipient_creator_id": "CRT_THE_BEATLES",
    "honor_type": "Lifetime Achievement Award",
    "announcement_year": 1960,
    "career_span_decades": 4,
    "presenting_dignitary_name": "Board of Trustees Chair",
    "citation_text": "Presented to The Beatles for enduring qualitative lifetime creative contributions to music.",
    "is_posthumous_award": true,
    "special_tribute_performance_flag": true
  },
  {
    "honor_id": "HON_LIFETIME_002",
    "ceremony_id": "CEREMONY_004",
    "recipient_creator_id": "CRT_ARETHA_FRANKLIN",
    "honor_type": "Lifetime Achievement Award",
    "announcement_year": 1961,
    "career_span_decades": 5,
    "presenting_dignitary_name": "Board of Trustees Chair",
    "citation_text": "Presented to Aretha Franklin for enduring qualitative lifetime creative contributions to music.",
    "is_posthumous_award": false,
    "special_tribute_performance_flag": true
  },
  {
    "honor_id": "HON_LIFETIME_003",
    "ceremony_id": "CEREMONY_005",
    "recipient_creator_id": "CRT_STEVIE_WONDER",
    "honor_type": "Lifetime Achievement Award",
    "announcement_year": 1962,
    "career_span_decades": 6,
    "presenting_dignitary_name": "Board of Trustees Chair",
    "citation_text": "Presented to Stevie Wonder for enduring qualitative lifetime creative contributions to music.",
    "is_posthumous_award": false,
    "special_tribute_performance_flag": true
  },
  {
    "honor_id": "HON_LIFETIME_004",
    "ceremony_id": "CEREMONY_006",
    "recipient_creator_id": "CRT_FRANK_SINATRA",
    "honor_type": "Lifetime Achievement Award",
    "announcement_year": 1963,
    "career_span_decades": 4,
    "presenting_dignitary_name": "Board of Trustees Chair",
    "citation_text": "Presented to Frank Sinatra for enduring qualitative lifetime creative contributions to music.",
    "is_posthumous_award": false,
    "special_tribute_performance_flag": true
  },
  {
    "honor_id": "HON_LIFETIME_005",
    "ceremony_id": "CEREMONY_007",
    "recipient_creator_id": "CRT_ELLA_FITZGERALD",
    "honor_type": "Lifetime Achievement Award",
    "announcement_year": 1964,
    "career_span_decades": 5,
    "presenting_dignitary_name": "Board of Trustees Chair",
    "citation_text": "Presented to Ella Fitzgerald for enduring qualitative lifetime creative contributions to music.",
    "is_posthumous_award": true,
    "special_tribute_performance_flag": true
  },
  {
    "honor_id": "HON_LIFETIME_006",
    "ceremony_id": "CEREMONY_008",
    "recipient_creator_id": "CRT_MILES_DAVIS",
    "honor_type": "Lifetime Achievement Award",
    "announcement_year": 1965,
    "career_span_decades": 6,
    "presenting_dignitary_name": "Board of Trustees Chair",
    "citation_text": "Presented to Miles Davis for enduring qualitative lifetime creative contributions to music.",
    "is_posthumous_award": false,
    "special_tribute_performance_flag": true
  },
  {
    "honor_id": "HON_LIFETIME_007",
    "ceremony_id": "CEREMONY_009",
    "recipient_creator_id": "CRT_CHUCK_BERRY",
    "honor_type": "Lifetime Achievement Award",
    "announcement_year": 1966,
    "career_span_decades": 4,
    "presenting_dignitary_name": "Board of Trustees Chair",
    "citation_text": "Presented to Chuck Berry for enduring qualitative lifetime creative contributions to music.",
    "is_posthumous_award": false,
    "special_tribute_performance_flag": true
  },
  {
    "honor_id": "HON_LIFETIME_008",
    "ceremony_id": "CEREMONY_010",
    "recipient_creator_id": "CRT_BOB_DYLAN",
    "honor_type": "Lifetime Achievement Award",
    "announcement_year": 1967,
    "career_span_decades": 5,
    "presenting_dignitary_name": "Board of Trustees Chair",
    "citation_text": "Presented to Bob Dylan for enduring qualitative lifetime creative contributions to music.",
    "is_posthumous_award": false,
    "special_tribute_performance_flag": true
  },
  {
    "honor_id": "HON_LIFETIME_009",
    "ceremony_id": "CEREMONY_011",
    "recipient_creator_id": "CRT_QUINCY_JONES",
    "honor_type": "Lifetime Achievement Award",
    "announcement_year": 1968,
    "career_span_decades": 6,
    "presenting_dignitary_name": "Board of Trustees Chair",
    "citation_text": "Presented to Quincy Jones for enduring qualitative lifetime creative contributions to music.",
    "is_posthumous_award": true,
    "special_tribute_performance_flag": true
  },
  {
    "honor_id": "HON_LIFETIME_010",
    "ceremony_id": "CEREMONY_012",
    "recipient_creator_id": "CRT_JIMI_HENDRIX",
    "honor_type": "Lifetime Achievement Award",
    "announcement_year": 1969,
    "career_span_decades": 4,
    "presenting_dignitary_name": "Board of Trustees Chair",
    "citation_text": "Presented to Jimi Hendrix for enduring qualitative lifetime creative contributions to music.",
    "is_posthumous_award": false,
    "special_tribute_performance_flag": true
  },
  {
    "honor_id": "HON_LIFETIME_011",
    "ceremony_id": "CEREMONY_013",
    "recipient_creator_id": "CRT_JOHNNY_CASH",
    "honor_type": "Lifetime Achievement Award",
    "announcement_year": 1970,
    "career_span_decades": 5,
    "presenting_dignitary_name": "Board of Trustees Chair",
    "citation_text": "Presented to Johnny Cash for enduring qualitative lifetime creative contributions to music.",
    "is_posthumous_award": false,
    "special_tribute_performance_flag": true
  },
  {
    "honor_id": "HON_LIFETIME_012",
    "ceremony_id": "CEREMONY_014",
    "recipient_creator_id": "CRT_RAY_CHARLES",
    "honor_type": "Lifetime Achievement Award",
    "announcement_year": 1971,
    "career_span_decades": 6,
    "presenting_dignitary_name": "Board of Trustees Chair",
    "citation_text": "Presented to Ray Charles for enduring qualitative lifetime creative contributions to music.",
    "is_posthumous_award": false,
    "special_tribute_performance_flag": true
  },
  {
    "honor_id": "HON_LIFETIME_013",
    "ceremony_id": "CEREMONY_015",
    "recipient_creator_id": "CRT_B_B_KING",
    "honor_type": "Lifetime Achievement Award",
    "announcement_year": 1972,
    "career_span_decades": 4,
    "presenting_dignitary_name": "Board of Trustees Chair",
    "citation_text": "Presented to B.B. King for enduring qualitative lifetime creative contributions to music.",
    "is_posthumous_award": true,
    "special_tribute_performance_flag": true
  },
  {
    "honor_id": "HON_LIFETIME_014",
    "ceremony_id": "CEREMONY_016",
    "recipient_creator_id": "CRT_DAVID_BOWIE",
    "honor_type": "Lifetime Achievement Award",
    "announcement_year": 1973,
    "career_span_decades": 5,
    "presenting_dignitary_name": "Board of Trustees Chair",
    "citation_text": "Presented to David Bowie for enduring qualitative lifetime creative contributions to music.",
    "is_posthumous_award": false,
    "special_tribute_performance_flag": true
  },
  {
    "honor_id": "HON_LIFETIME_015",
    "ceremony_id": "CEREMONY_017",
    "recipient_creator_id": "CRT_PRINCE",
    "honor_type": "Lifetime Achievement Award",
    "announcement_year": 1974,
    "career_span_decades": 6,
    "presenting_dignitary_name": "Board of Trustees Chair",
    "citation_text": "Presented to Prince for enduring qualitative lifetime creative contributions to music.",
    "is_posthumous_award": false,
    "special_tribute_performance_flag": true
  },
  {
    "honor_id": "HON_LIFETIME_016",
    "ceremony_id": "CEREMONY_018",
    "recipient_creator_id": "CRT_THE_BEATLES",
    "honor_type": "Lifetime Achievement Award",
    "announcement_year": 1975,
    "career_span_decades": 4,
    "presenting_dignitary_name": "Board of Trustees Chair",
    "citation_text": "Presented to The Beatles for enduring qualitative lifetime creative contributions to music.",
    "is_posthumous_award": false,
    "special_tribute_performance_flag": true
  },
  {
    "honor_id": "HON_LIFETIME_017",
    "ceremony_id": "CEREMONY_019",
    "recipient_creator_id": "CRT_ARETHA_FRANKLIN",
    "honor_type": "Lifetime Achievement Award",
    "announcement_year": 1976,
    "career_span_decades": 5,
    "presenting_dignitary_name": "Board of Trustees Chair",
    "citation_text": "Presented to Aretha Franklin for enduring qualitative lifetime creative contributions to music.",
    "is_posthumous_award": true,
    "special_tribute_performance_flag": true
  },
  {
    "honor_id": "HON_LIFETIME_018",
    "ceremony_id": "CEREMONY_020",
    "recipient_creator_id": "CRT_STEVIE_WONDER",
    "honor_type": "Lifetime Achievement Award",
    "announcement_year": 1977,
    "career_span_decades": 6,
    "presenting_dignitary_name": "Board of Trustees Chair",
    "citation_text": "Presented to Stevie Wonder for enduring qualitative lifetime creative contributions to music.",
    "is_posthumous_award": false,
    "special_tribute_performance_flag": true
  },
  {
    "honor_id": "HON_LIFETIME_019",
    "ceremony_id": "CEREMONY_021",
    "recipient_creator_id": "CRT_FRANK_SINATRA",
    "honor_type": "Lifetime Achievement Award",
    "announcement_year": 1978,
    "career_span_decades": 4,
    "presenting_dignitary_name": "Board of Trustees Chair",
    "citation_text": "Presented to Frank Sinatra for enduring qualitative lifetime creative contributions to music.",
    "is_posthumous_award": false,
    "special_tribute_performance_flag": true
  },
  {
    "honor_id": "HON_LIFETIME_020",
    "ceremony_id": "CEREMONY_022",
    "recipient_creator_id": "CRT_ELLA_FITZGERALD",
    "honor_type": "Lifetime Achievement Award",
    "announcement_year": 1979,
    "career_span_decades": 5,
    "presenting_dignitary_name": "Board of Trustees Chair",
    "citation_text": "Presented to Ella Fitzgerald for enduring qualitative lifetime creative contributions to music.",
    "is_posthumous_award": false,
    "special_tribute_performance_flag": true
  },
  {
    "honor_id": "HON_LIFETIME_021",
    "ceremony_id": "CEREMONY_023",
    "recipient_creator_id": "CRT_MILES_DAVIS",